,Song Title,Artists,Producers,Genius ViewCount,Song Rank,Year,Lyrics
47,Lucid Dreams,"('Juice WRLD',)",['Nick Mira'],3890660,12,2018,"[Intro]
Enviyon on the mix
No, no, no, no
No-no, no, no, no
No, no, no, no, no
No, no, no, no

[Chorus]
I still see your shadows in my room
Can't take back the love that I gave you
It's to the point where I love and I hate you
And I cannot change you, so I must replace you, oh
Easier said than done, I thought you were the one
Listenin' to my heart instead of my head
You found another one, but I am the better one
I won't let you forget me
I still see your shadows in my room
Can't take back the love that I gave you
It's to the point where I love and I hate you
And I cannot change you, so I must replace you, oh
Easier said than done, I thought you were the one
Listenin' to my heart instead of my head
You found another one, but I am the better one
I won't let you forget me

[Verse]
You left me falling and landing inside my grave
I know that you want me dead
I take prescriptions to make me feel a-okay
I know it's all in my head
I have these lucid dreams where I can't move a thing
Thinking of you in my bed
You were my everything
Thoughts of a wedding ring
Now I'm just better off dead (Uh, uh, uh)
I'll do it over again
I didn't want it to end
I watch it blow in the wind
I should've listened to my friends
Leave this shit in the past, but I want it to last
You were made outta plastic, fake
I was tangled up in your drastic ways
Who knew evil girls had the prettiest face?
You gave me a heart that was full of mistakes
I gave you my heart and you made heartbreak

[Bridge]
You made my heart break
You made my heart ache (I still see your shadows in my room)
You made my heart break
You made my heart ache (Can't take back the love that I gave you)
You made my heart break (Were made outta plastic, fake)
You made my heart ache (I still see your shadows in my room)
You made my heart break again (I was tangled up in your drastic ways)
(Who knew evil girls had the prettiest face?)

[Chorus]
I still see your shadows in my room
Can't take back the love that I gave you
It's to the point where I love and I hate you
And I cannot change you, so I must replace you, oh
Easier said than done, I thought you were the one
Listenin' to my heart instead of my head
You found another one, but I am the better one
I won't let you forget me
I still see your shadows in my room
Can't take back the love that I gave you
It's to the point where I love and I hate you
And I cannot change you, so I must replace you, oh
Easier said than done, I thought you were the one
Listenin' to my heart instead of my head
You found another one, but I am the better one
I won't let you forget me

[Outro]
Leave this shit in the past, but I want it to last
You were made outta plastic, fake
I was tangled up in your drastic ways
Who knew evil girls had the prettiest face?
Easier said than done, I thought you were—
—instead of my head
You found another— better one
I won't let you forget me"
48,Marry Me,"('Thomas Rhett',)","['Thomas Rhett', 'Jesse Frasure', 'Dann Huff']",148273,76,2018,"[Verse 1]
She wants to get married, she wants it perfect
She wants her granddaddy preaching the service
And she wants magnolias out in the country
Not too many people, save her daddy some money

[Pre-Chorus 1]
Ooh, she got it all planned out
Yeah, I can see it all right now

[Chorus 1]
I'll wear my black suit, black tie, hide out in the back
I'll do a strong shot of whiskey straight out the flask
I'll try to make it through without crying so nobody sees
Yeah, she wanna get married
But she don't wanna marry me

[Verse 2]
I remember the night when I almost kissed her
Yeah, I kinda freaked out, we've been friends for forever
And I'd always wonder if she felt the same way
When I got the invite, I knew it was too late

[Pre-Chorus 2]
And I know her daddy's been dreading this day
Oh, but he don't know he ain't the only one giving her away

[Chorus 1]
I'll wear my black suit, black tie, hide out in the back
I'll do a strong shot of whiskey straight out the flask
I'll try to make it through without crying so nobody sees
Yeah, she wanna get married
But she don't wanna marry me

[Bridge]
Bet she got on her dress now, welcoming the guests now
I could try to find her, get it off of my chest now
But I ain't gonna mess it up, so I wish her the best now

[Chorus 2]
So I'm in my black suit, black tie, hiding out in the back
Doing a strong shot of whiskey straight out the flask
I'll try to make it through without crying so nobody sees
Yeah, she wanna get married
Yeah, she gonna get married
But she ain't gonna marry me
Whoa, but she ain't gonna marry me, no"
49,Meant To Be,"('Bebe Rexha', 'Florida Georgia Line')","['Willshire', 'David Garcia']",589356,3,2018,"[Verse 1: Florida Georgia Line]
Baby, lay on back and relax
Kick your pretty feet up on my dash
No need to go nowhere fast
Let's enjoy right here where we at

[Pre-Chorus 1: Florida Georgia Line]
Who knows where this road is supposed to lead?
We got nothing, but time
As long as you're right here next to me
Everything's gonna be alright

[Chorus: Florida Georgia Line]
If it's meant to be, it'll be, it'll be
Baby, just let it be
If it's meant to be, it'll be, it'll be
Baby, just let it be
So won't you ride with me, ride with me?
See where this thing goes
If it's meant to be, it'll be, it'll be
Baby, if it's meant to be

[Verse 2: Bebe Rexha]
I don't mean to be so uptight
But my heart's been hurt a couple times
By a couple guys that didn't treat me right
I ain't gon' lie, ain't gon' lie
'Cause I'm tired of the fake love
Show me what you're made of
Boy, make me believe

[Pre-Chorus 2: Florida Georgia Line]
Whoa, hold up girl, don't you know you're beautiful?
And it's easy to see

[Chorus: Bebe Rexha & Florida Georgia Line]
If it's meant to be, it'll be, it'll be
Baby, just let it be
If it's meant to be, it'll be, it'll be
Baby, just let it be
So won't you ride with me, ride with me?
See where this thing goes
If it's meant to be, it'll be, it'll be
Baby, if it's meant to be

[Post-Chorus: Bebe Rexha & Florida Georgia Line]
So c'mon, ride with me, ride with me
See where this thing goes
So c'mon, ride with me, ride with me
Baby, if it's meant to be

[Bridge: Bebe Rexha, Florida Georgia Line, Both]
Maybe we do
Maybe we don't
Maybe we will
Maybe we won't

[Chorus: Bebe Rexha, Florida Georgia Line, Both]
But if it's meant to be, it'll be, it'll be
Baby, just let it be (Sing it, Bebe)
If it's meant to be, it'll be, it'll be (C'mon)
Baby, just let it be (Let's go)
So won't you ride with me, ride with me?
See where this thing goes (Come for a ride)
If it's meant to be, it'll be, it'll be
Baby, if it's meant to be (Yeah)

[Outro: Florida Georgia Line, Bebe Rexha, Both]
If it's meant to be, it'll be, it'll be
Baby, if it's meant to be
If it's meant to be, it'll be, it'll be
Baby, if it's meant to be
Hmm"
50,Mercy,"('Brett Young',)",['Dann Huff'],209244,95,2018,"[Verse 1]
Mercy
Why you gotta show up lookin' so good just to hurt me?
Why you wanna stop this whole damn world from turning?
Mercy
Why you hanging on so tight if this ain't working?
Why you wanna stop this flame if it's still burning?
Cause it's still burning

[Chorus]
So if you're gonna break my heart, just break it
And if you're gonna take your shot, then take it
Take it
If you made up your mind, then make it
But make this fast
If you ever loved me
Have mercy

[Verse 2]
If you go out tonight and get drunk and lonely
Wind up home alone please don't call me
And say you miss me, no

[Chorus]
So if you're gonna break my heart, just break it
And if you're gonna take your shot, then take it
Take it
If you made up your mind, then make it
But make this fast
If you ever loved me
Have mercy

[Bridge]
Woah
Oh have mercy

[Chorus]
If you're gonna break my heart, just break it
If you're gonna take your shot, take it
Take it
Oh if you're gonna break my heart, just break it
And if you're gonna take your shot, then take it
Take it
If you made up your mind, then make it
But make this fast
If you ever loved me
Mmmh if you ever loved me
Have mercy
Oh have mercy
Oh have mercy
Have mercy"
51,Mi Gente,"('J Balvin', 'Willy William', 'Beyonce')",['Willy William'],1508008,99,2018,"[Letra de ""Mi Gente""]

[Verso 1: J Balvin]
Si el ritmo te lleva a mover la cabeza
Ya empezamos como es
Mi música no discrimina a nadie
Así que vamos a romper
Toda mi gente se mueve
Mira el ritmo cómo los tiene
Hago música que entretiene
El mundo nos quiere, nos quiere
Me quiere a mí
Toda mi gente se mueve
Mira el ritmo cómo los tiene
Hago música que entretiene
Mi música los tiene fuerte bailando
Y se baila así

[Coro: Instrumental]

[Verso 2: Willy William]
Tamo' rompiendo la discoteca
La fiesta no para, apenas comienza
C'est comme-ci, c'est comme ça
Ma chèrie, la-la-la-la-la
Francia, Colombia
Me gusta (Freeze)
J Balvin, Willy William
Le gusta (Freeze)
Los DJ's no mienten, le gusta a mi gente
Y eso se fue mundial (Freeze)
No le bajamos, más nunca paramos
Es otro palo y ¡blam!

[Pre-Coro: J Balvin, Willy William]
¿Y dónde está mi gente?
Mais fais bouger la tête
¿Y dónde está mi gente?
Say yeah, yeah, yeah
Un, dos, tres, ¡leggo!
(Ay di que sí)

[Coro: Instrumental]

[Verso 3: J Balvin]
Esquina a esquina, de ahí no' vamo'
El mundo es grande pero lo tengo en mi' manos
Estoy muy duro, sí, ok, ahí vamos
Y con el tiempo nos seguimos elevando
Que seguimos rompiendo aquí
Esta fiesta no tiene fin
Botellas para arriba, sí
Los tengo bailando, rompiendo y yo sigo aquí
Que seguimos rompiendo aquí
Esta fiesta no tiene fin
Botellas para arriba, sí
Los tengo bailando, rompiendo y yo sigo aquí

[Pre-Coro: J Balvin, Willy William]
¿Y dónde está mi gente?
Mais fais bouger la tête
¿Y dónde está mi gente?
Say yeah, yeah, yeah
Un, dos, tres, ¡leggo!
(Ay di que sí)

[Coro: Instrumental]

[Outro: J Balvin]
Worldwide
Willy William
J Balvin, man
Uh-huh
Uh-huh
Uh-huh
Uh-huh"
52,Mine,"('Bazzi',)","['Rice N’ Peas', 'Bazzi']",1711387,21,2018,"[Intro]
Huh, yeah, naw I just, had a lil' bit too much of Hennessy
Just gotta tell you how I feel, look

[Verse 1]
You so fuckin' precious when you smile
Hit it from the back and drive you wild
Girl, I lose myself up in those eye-eye-eye-eye-eyes
I just had to let you know you're mine

[Chorus]
Hands on your body, I don't wanna waste no time
Feels like forever even if forever's tonight
Just lay with me, waste this night away with me
You're mine, I can't look away, I just gotta say

[Verse 2]
I'm so fucking happy you're alive
Swear to God I'm down if you're down all you gotta say is right
Girl anything I can do just to make you feel alright
Oh, oh, oh, oh, I just had to let you know you're fine
Running circles 'round my mind
Even when it's rainy all you ever do is shine
You on fire, you a star just like Mariah
Man this feel incredible, I'll turn you into a bride, you're mine

[Chorus]
Hands on your body, I don't wanna waste no time
Feels like forever even if forever's tonight
Just lay with me, waste this night away with me
You're mine, I can't look away, I just gotta say"
53,Moonlight,"('XXXTENTACION',)",['John Cunningham'],2460658,88,2018,"[Intro]
Yeah

[Chorus]
Spotlight, uh, moonlight, uh
Nigga, why you trippin'? Get your mood right, uh
Shawty look good in the moonlight
All these pussy niggas so bad mind
Spotlight, moonlight
Nigga, why you trippin'? Get your mood right
Shawty look good in the moonlight
All these pussy niggas so bad mind
Spotlight, uh, moonlight
Nigga, why you trippin'? Get your mood right, uh
Shawty look good in the moonlight
All these pussy niggas so bad mind
Spotlight, moonlight
Nigga, why you trippin'? Get your mood right
Shawty look good in the moonlight
All these pussy niggas so bad mind

[Verse]
Feel like I'm destined
I don't need no Smith & Wesson, no
Boy, who you testin'?
Fuck a Scantron, here's your lesson, oh
Knife in intestine
Takin' shots at all your brethren, no
Feel like I'm damaged
Girl I know you fucking planned this

[Bridge]
All alone, call my phone, make me feel right
Girl you know when you call, make me feel right
All alone, call my phone, make me feel right
Girl you know when you call, make me feel right

[Chorus]
Spotlight, uh, moonlight, uh
Nigga, why you trippin'? Get your mood right, uh
Shawty look good in the moonlight
All these pussy niggas so bad mind
Spotlight, moonlight
Nigga, why you trippin'? Get your mood right
Shawty look good in the moonlight
All these pussy niggas so bad mind
Spotlight, uh, moonlight
Nigga, why you trippin'? Get your mood right, uh
Shawty look good in the moonlight
All these pussy niggas so bad mind
Spotlight, moonlight
Nigga, why you trippin'? Get your mood right
Shawty look good in the moonlight
All these pussy niggas so bad mind"
54,MotorSport,"('Migos', 'Nicki Minaj', 'Cardi B')","['CuBeatz', 'Murda Beatz']",4067965,34,2018,"[Intro: Quavo]
Yeah, woo, yeah, skrrt
M-M-M-Murda

[Chorus: Quavo]
Motorsport, yeah, put that thing in sport (Skrrt, skrrt)
Shawty bad (Bad), pop her like a cork (Pop it)
You a dork, never been a sport (Dork, yeah)
Pull up, woo, woo, jumpin' out the court (Jump)
Cotton candy (Drink), my cup tastes like the fair (Cotton)
Straight up there (Where?), we didn't take the stairs (Where?)
Faced my fears (My fears), gave my mama tears (Mama)
Shiftin' gears (Shift), on the Nawf, get serious (Serious)

[Verse 1: Quavo]
Face all your fears, then get at me
Hit so many donuts on them backstreets
Sit so high in the nosebleeds (Yeah)
Feel like I can fly, yeah
Xans, Perky, check (Yeah), Bill Belichick
Take the air out the ball (Ooh), just so I can flex
Take the air out the mall, walk in with the sacks
Take the air out your broad (Hey), now she can't go back (E)
Xans, Perky, check (Yeah), Bill Belichick
Take the air out the ball (Yeah), just so I can flex
Take the air out the mall (Hey), walk in with the sacks
Take the air out your broad (Woo, woo, woo, E)

[Verse 2: Offset]
Offset!
Uh, the coupe came imported (Hey)
This season's Off-White come in snorted (White)
Green Lamborghini a tortoise (Lambo)
No human being, I'm immortal (No)
Patek and A.P. full of water (Patek)
Hundred K, I spend on my señora (Racks)
My pinky on margarine, butter (Margarine)
And my ears got McDonald's nuggets (Ayy)
Soon, as I land on the Lear (Whew)
Piguets, they wet, tears ('Guets)
488, hit the gears (488)
Suicide doors, Britney Spears
I'm boujee, so, bitch, don't get near (Boujee)
Criss Angel, make dope disappear (Voilà)
Hit the gas, it got flames out the rears (Skrrt)
It's a race to the bag, get the mills (Hey)

[Verse 3: Cardi B]
Ride the dick like a BMX
No nigga wanna be my ex (No)
I love when he go on tour
'Cause he cums more, when I see him less
I get up set off
I turn Offset on
I told him the other day
Man, we should sell that porn
Yeah, Cardi B, I'm back, bitches
I don't wanna hear I'm actin' different (Yeah)
Same lips that be talkin' 'bout me
Is the same lips that be ass kissin'
These hoes ain't what they say they are
And their pussy stink, they catfishin' (Stank)
Same hoes that was sendin' shots
They reachin' out like they back itchin' (Whoo)
Why would I hop in some beef (Why?)
When I could just hop in a Porsche?
You heard she gon' do what from who?
That's not a reliable source, no
So tell me, have you seen her?
Let me wrap my weave up
I'm the trap Selena
¡Dame más gasolina! Skrrt!

[Chorus: Quavo]
Motorsport, yeah, put that thing in sport (Skrrt, skrrt)
Shawty bad (Bad), pop her like a cork (Pop it)
You a dork, never been a sport (Dork, yeah)
Pull up, woo, woo, jumpin' out the court (Jump)

[Verse 4: Nicki Minaj]
Uh, yo, watch your man, then you should watch your mouth
Bitches is pressed, administer mouth to mouth
You see them stats, you know what I am about
I am the champ, I'm Iron Mike in a bout
Attention, I'ma need you to face front
You don't want smoke with me, this is a laced blunt
Rap's Jackie Chan, we ain't pullin' them fake stunts
My crown won't fit on your bum-ass lace fronts (Uh)
You bitches catchin' a fade, shout out my nigga Lil Boosie
All of your friends'll be dead, you can get hit with that Uzi
I call him Ricky, he say he love me like Lucy
Get you a straw nigga, you know this pussy is juicy
This Givenchy is custom made, now you can't get it at Saks though
I don't work in no office, but they copyin' and that's facts though
I ain't tryna be violent, but if Nicki on it, it slaps, ho
Get you lined for that paper like a loose leaf when that strap blow
I'm with a couple bad bitches that'll rip the party
If Quavo the QB, I'm Nick Lombardi
Pull up in the space coupe, I done linked with Marty
I can actually afford to get a pink Bugatti
""Ayo, Nick, didn't you just do a hit with Gotti?""
That too, but my niggas send hits like Gotti
It's a wrap, like the things on the head of a Saudi
Bitch, you my son, go and sit on the potty (Rrrrrr)

[Verse 5: Takeoff]
Brand new Chanels (Chanels)
I scuffed 'em runnin' from 12 (12)
Ain't make no commitment with none of you bitches
'Cause money is treatin' me well (Uh-uh)
If Nicki should show me her titty
Right hand on the Bible, I swear I won't tell (Swear)
If I get to play with that kitty
I wonder how many platinums we gon' sell (Albums)
Pop a Perc and catch a feel (I pop one)
Now I cannot feel the wheel (Woah)
My chest bad, give me chills (Ice)
And the left hand on Richard Mille (Ice)
Not the watch, but the price on the ice
If you don't know what that is (Huh)
Motorsport, motorville
Abort the mission, that's a kill (Pew, pew, brrr)

[Chorus: Quavo]
Motorsport, yeah, put that thing in sport (Skrrt, skrrt)
Shawty bad (Bad), pop her like a cork (Pop it)
You a dork, never been a sport (Dork, yeah)
Pull up, woo, woo, jumpin' out the court (Jump)
Cotton candy (Drink), my cup tastes like the fair (Cotton)
Straight up there (Where?), we didn't take the stairs (Where?)
Faced my fears (My fears), gave my mama tears (Mama)
Shiftin' gears (Shift), on the Nawf, get serious (Serious)

[Outro: Quavo]
Girl, yeah, yeah, I wish my grandma could see me (Grandma)
Take away pain, ain't easy (Pain)
That's why I fire up a bleezy (Fire)
Niggas not cappin' this season"
55,Natural,"('Imagine Dragons',)",['Mattman & Robin'],699761,69,2018,"[Verse 1]
Will you hold the line
When every one of them has given up and given in? Tell me
In this house of mine
Nothing ever comes without a consequence or cost, tell me
Will the stars align?
Will Heaven step in? Will it save us from our sin? Will it?
'Cause this house of mine stands strong

[Pre-Chorus]
That's the price you pay
Leave behind your heart and cast away
Just another product of today
Rather be the hunter than the prey
And you're standing on the edge, face up 'cause you're a

[Chorus]
Natural
A beating heart of stone
You gotta be so cold
To make it in this world
Yeah, you're a natural
Living your life cutthroat
You gotta be so cold
Yeah, you're a natural

[Verse 2]
Will somebody
Let me see the light within the dark trees shadowing?
What's happenin'?
Lookin' through the glass, find the wrong within the past knowin'
Oh, we are the youth
Cut until it bleeds inside a world without the peace, facing
A bit of the truth, the truth

[Pre-Chorus]
That's the price you pay
Leave behind your heart and cast away
Just another product of today
Rather be the hunter than the prey
And you're standing on the edge, face up 'cause you're a

[Chorus]
Natural
A beating heart of stone
You gotta be so cold
To make it in this world
Yeah, you're a natural
Living your life cutthroat
You gotta be so cold
Yeah, you're a natural

[Bridge]
Deep inside me, I'm fading to black, I'm fading
Took an oath by the blood of my hand, won't break it
I can taste it, the end is upon us, I swear
I'm gonna make it
I'm gonna make it

[Chorus]
Natural
A beating heart of stone
You gotta be so cold
To make it in this world
Yeah, you're a natural
Living your life cutthroat
You gotta be so cold
Yeah, you're a natural

[Outro]
Natural
Yeah, you're a natural"
56,Never Be The Same,"('Camila Cabello',)","['Jarami', 'Frank Dukes']",1868911,18,2018,"[Verse 1]
Somethin' must've gone wrong in my brain
Got your chemicals all in my veins
Feelin' all the highs, feelin' all the pain
Let go of the wheel, that's the bullet lane
Now I'm seein' red, not thinkin' straight
Blurrin' all the lines, you intoxicate me

[Pre-Chorus]
Just like nicotine, heroin, morphine
Suddenly, I'm a fiend and you're all I need
All I need, yeah, you're all I need

[Chorus]
It's you, babe
And I'm a sucker for the way that you move, babe
And I could try to run, but it would be useless
You're to blame
Just one hit of you, I knew I'll never be the same
It's you, babe
And I'm a sucker for the way that you move, babe
And I could try to run, but it would be useless
You're to blame
Just one hit of you, I knew I'll never ever, ever be the same

[Post-Chorus]
I'll never be the same
I'll never be the same
I'll never be the same

[Verse 2]
Sneakin' in L.A. when the lights are low
Off of one touch, I could overdose
You said, ""Stop playin' it safe
Girl, I wanna see you lose control""

[Pre-Chorus]
Just like nicotine, heroin, morphine
Suddenly, I'm a fiend and you're all I need
All I need, yeah, you're all I need

[Chorus]
It's you, babe
And I'm a sucker for the way that you move, babe
And I could try to run, but it would be useless
You're to blame
Just one hit of you, I knew I'll never be the same
It's you, babe
And I'm a sucker for the way that you move, babe
And I could try to run, but it would be useless
You're to blame
Just one hit of you, I knew I'll never ever, ever be the same

[Post-Chorus]
I'll never be the same
I'll never be the same
I'll never be the same

[Bridge]
You're in my blood, you're in my veins, you're in my head (I blame)
You're in my blood, you're in my veins, you're in my head (I'm sayin')

[Chorus]
I'm sayin' it's you, babe
And I'm a sucker for the way that you move, babe
And I could try to run, but it would be useless
You're to blame (You're to blame)
Just one hit of you, I knew I'll never be the same (I'll never be the...)
It's you, babe
And I'm a sucker for the way that you move, babe
And I could try to run, but it would be useless
You're to blame
Just one hit of you, I knew I'll never ever, ever be the same"
57,New Rules,"('Dua Lipa',)",['Ian Kirkpatrick'],4293008,16,2018,"[Intro]
One, one, one, one, one

[Verse 1]
Talkin' in my sleep at night, makin' myself crazy
(Out of my mind, out of my mind)
Wrote it down and read it out, hopin' it would save me
(Too many times, too many times)

[Refrain]
My love, he makes me feel like nobody else, nobody else
But my love, he doesn't love me, so I tell myself, I tell myself

[Pre-Chorus]
One: Don't pick up the phone
You know he's only callin' 'cause he's drunk and alone
Two: Don't let him in
You'll have to kick him out again
Three: Don't be his friend
You know you're gonna wake up in his bed in the morning
And if you're under him, you ain't gettin' over him

[Chorus]
I got new rules, I count 'em
I got new rules, I count 'em
I gotta tell them to myself
I got new rules, I count 'em
I gotta tell them to myself

[Verse 2]
I keep pushin' forwards, but he keeps pullin' me backwards
(Nowhere to turn, no way)
(Nowhere to turn, no)
Now I'm standin' back from it, I finally see the pattern
(I never learn, I never learn)

[Refrain]
But my love, he doesn't love me, so I tell myself, I tell myself
I do, I do, I do

[Pre-Chorus]
One: Don't pick up the phone
You know he's only callin' 'cause he's drunk and alone
Two: Don't let him in
You'll have to kick him out again
Three: Don't be his friend
You know you're gonna wake up in his bed in the morning
And if you're under him, you ain't gettin' over him

[Chorus]
I got new rules, I count 'em
I got new rules, I count 'em
I gotta tell them to myself
I got new rules, I count 'em
I gotta tell them to myself

[Bridge]
Practice makes perfect
I'm still tryna learn it by heart (I got new rules, I count 'em)
Eat, sleep, and breathe it
Rehearse and repeat it, 'cause I (I got new)

[Pre-Chorus]
One: Don't pick up the phone (yeah)
You know he's only callin' 'cause he's drunk and alone (alone)
Two: Don't let him in (uh-ooh)
You'll have to kick him out again (again)
Three: Don't be his friend
You know you're gonna wake up in his bed in the morning
And if you're under him, you ain't gettin' over him

[Chorus]
I got new rules, I count 'em
I got new rules, I count 'em
(Whoa-ooh, whoa-ooh, whoa)
I gotta tell them to myself
I got new rules, I count 'em
(Baby, you know I count 'em)
I gotta tell them to myself

[Outro]
Don't let him in, don't let him in
Don't, don't, don't, don't
Don't be his friend, don't be his friend
Don't, don't, don't, don't
Don't let him in, don't let him in
Don't, don't, don't, don't
Don't be his friend, don't be his friend
Don't, don't, don't, don't
You're gettin' over him"
